Offer Image,Offer Title,Offer Description,Offer Validity,Offer Link,Eligible Credit Cards
https://gos3.ibcdn.com/img-1751609371.jpg,"Hotels, Flights",Up to 15% OFF on Travel Bookings!,Limited period offer,https://www.goibibo.com/offers/axis-bank-emi/,Axis Bank Horizon Credit Card
https://gos3.ibcdn.com/img-1751609371.jpg,"Hotels, Flights",Up to 15% OFF on Travel Bookings!,Limited period offer,https://www.goibibo.com/offers/axis-bank-emi/,Axis Horizon Mastercard Credit Card
https://gos3.ibcdn.com/img-1751609371.jpg,"Hotels, Flights",Up to 15% OFF on Travel Bookings!,Limited period offer,https://www.goibibo.com/offers/axis-bank-emi/,Airtel Axis Bank RuPay Credit Card
https://gos3.ibcdn.com/img-1751609371.jpg,"Hotels, Flights",Up to 15% OFF on Travel Bookings!,Limited period offer,https://www.goibibo.com/offers/axis-bank-emi/,Fibe Axis Bank Rupay Credit Card
https://gos3.ibcdn.com/img-1751609371.jpg,"Hotels, Flights",Up to 15% OFF on Travel Bookings!,Limited period offer,https://www.goibibo.com/offers/axis-bank-emi/,Axis Bank Ace Credit Card
https://gos3.ibcdn.com/img-1751609371.jpg,"Hotels, Flights",Up to 15% OFF on Travel Bookings!,Limited period offer,https://www.goibibo.com/offers/axis-bank-emi/,Axis Bank My Wings Credit Card
https://gos3.ibcdn.com/img-1751609371.jpg,"Hotels, Flights",Up to 15% OFF on Travel Bookings!,Limited period offer,https://www.goibibo.com/offers/axis-bank-emi/,Samsung Axis Bank Signature Credit Card
https://gos3.ibcdn.com/img-1751609371.jpg,"Hotels, Flights",Up to 15% OFF on Travel Bookings!,Limited period offer,https://www.goibibo.com/offers/axis-bank-emi/,Axis Bank Select Credit Card
https://gos3.ibcdn.com/img-1751609371.jpg,"Hotels, Flights",Up to 15% OFF on Travel Bookings!,Limited period offer,https://www.goibibo.com/offers/axis-bank-emi/,Axis Bank Reserve Credit Card
https://gos3.ibcdn.com/img-1751609371.jpg,"Hotels, Flights",Up to 15% OFF on Travel Bookings!,Limited period offer,https://www.goibibo.com/offers/axis-bank-emi/,Axis Bank SpiceJet Voyage Black Credit Card
https://gos3.ibcdn.com/img-1751609371.jpg,"Hotels, Flights",Up to 15% OFF on Travel Bookings!,Limited period offer,https://www.goibibo.com/offers/axis-bank-emi/,Axis Bank Atlas Credit Card
https://gos3.ibcdn.com/img-1751609371.jpg,"Hotels, Flights",Up to 15% OFF on Travel Bookings!,Limited period offer,https://www.goibibo.com/offers/axis-bank-emi/,Axis Bank Aura Credit Card
https://gos3.ibcdn.com/img-1751609371.jpg,"Hotels, Flights",Up to 15% OFF on Travel Bookings!,Limited period offer,https://www.goibibo.com/offers/axis-bank-emi/,Axis Bank Vistara Signature Credit Card
https://gos3.ibcdn.com/img-1751609371.jpg,"Hotels, Flights",Up to 15% OFF on Travel Bookings!,Limited period offer,https://www.goibibo.com/offers/axis-bank-emi/,Axis Bank MY Zone Credit Card
https://gos3.ibcdn.com/img-1751609371.jpg,"Hotels, Flights",Up to 15% OFF on Travel Bookings!,Limited period offer,https://www.goibibo.com/offers/axis-bank-emi/,IndianOil Axis Bank Credit Card
https://gos3.ibcdn.com/img-1751609371.jpg,"Hotels, Flights",Up to 15% OFF on Travel Bookings!,Limited period offer,https://www.goibibo.com/offers/axis-bank-emi/,Axis Bank Titanium Smart Traveller Credit Card
https://gos3.ibcdn.com/img-1751609371.jpg,"Hotels, Flights",Up to 15% OFF on Travel Bookings!,Limited period offer,https://www.goibibo.com/offers/axis-bank-emi/,Axis Insta Easy Credit Card
https://gos3.ibcdn.com/img-1751609371.jpg,"Hotels, Flights",Up to 15% OFF on Travel Bookings!,Limited period offer,https://www.goibibo.com/offers/axis-bank-emi/,Airtel Axis Bank Visa Credit Card
https://gos3.ibcdn.com/img-1751609371.jpg,"Hotels, Flights",Up to 15% OFF on Travel Bookings!,Limited period offer,https://www.goibibo.com/offers/axis-bank-emi/,Axis KWIK Credit Card
https://gos3.ibcdn.com/img-1751609371.jpg,"Hotels, Flights",Up to 15% OFF on Travel Bookings!,Limited period offer,https://www.goibibo.com/offers/axis-bank-emi/,Axis Bank Signature Credit Card
https://gos3.ibcdn.com/img-1751609371.jpg,"Hotels, Flights",Up to 15% OFF on Travel Bookings!,Limited period offer,https://www.goibibo.com/offers/axis-bank-emi/,Axis Bank Freecharge Plus Credit Card
https://gos3.ibcdn.com/img-1751609371.jpg,"Hotels, Flights",Up to 15% OFF on Travel Bookings!,Limited period offer,https://www.goibibo.com/offers/axis-bank-emi/,Axis Bank Platinum Credit Card
https://gos3.ibcdn.com/img-1751609371.jpg,"Hotels, Flights",Up to 15% OFF on Travel Bookings!,Limited period offer,https://www.goibibo.com/offers/axis-bank-emi/,Axis Bank Shoppers Stop Credit Card
https://gos3.ibcdn.com/img-1751609371.jpg,"Hotels, Flights",Up to 15% OFF on Travel Bookings!,Limited period offer,https://www.goibibo.com/offers/axis-bank-emi/,Axis Bank Vistara Credit Card
https://gos3.ibcdn.com/img-1751609371.jpg,"Hotels, Flights",Up to 15% OFF on Travel Bookings!,Limited period offer,https://www.goibibo.com/offers/axis-bank-emi/,LIC Axis Bank Signature Credit Card
https://gos3.ibcdn.com/img-1751609371.jpg,"Hotels, Flights",Up to 15% OFF on Travel Bookings!,Limited period offer,https://www.goibibo.com/offers/axis-bank-emi/,Axis Bank Freecharge Credit Card
https://gos3.ibcdn.com/img-1751609371.jpg,"Hotels, Flights",Up to 15% OFF on Travel Bookings!,Limited period offer,https://www.goibibo.com/offers/axis-bank-emi/,Axis Bank Pride Signature Credit Card
https://gos3.ibcdn.com/img-1751609371.jpg,"Hotels, Flights",Up to 15% OFF on Travel Bookings!,Limited period offer,https://www.goibibo.com/offers/axis-bank-emi/,Flipkart Axis Bank Credit Card
https://gos3.ibcdn.com/img-1751609371.jpg,"Hotels, Flights",Up to 15% OFF on Travel Bookings!,Limited period offer,https://www.goibibo.com/offers/axis-bank-emi/,Axis Bank Privilege Credit Card
https://gos3.ibcdn.com/img-1751609371.jpg,"Hotels, Flights",Up to 15% OFF on Travel Bookings!,Limited period offer,https://www.goibibo.com/offers/axis-bank-emi/,LIC Axis Bank Platinum Credit Card
https://gos3.ibcdn.com/img-1751609371.jpg,"Hotels, Flights",Up to 15% OFF on Travel Bookings!,Limited period offer,https://www.goibibo.com/offers/axis-bank-emi/,Axis Bank Neo Credit Card
https://gos3.ibcdn.com/img-1751609371.jpg,"Hotels, Flights",Up to 15% OFF on Travel Bookings!,Limited period offer,https://www.goibibo.com/offers/axis-bank-emi/,Spicejet Axis Bank Voyage Credit Card
https://gos3.ibcdn.com/img-1751609371.jpg,"Hotels, Flights",Up to 15% OFF on Travel Bookings!,Limited period offer,https://www.goibibo.com/offers/axis-bank-emi/,Axis Bank Pride Platinum Credit Card
https://gos3.ibcdn.com/img-1751609371.jpg,"Hotels, Flights",Up to 15% OFF on Travel Bookings!,Limited period offer,https://www.goibibo.com/offers/axis-bank-emi/,Axis Bank Rewards Credit Card
https://gos3.ibcdn.com/img-1751609371.jpg,"Hotels, Flights",Up to 15% OFF on Travel Bookings!,Limited period offer,https://www.goibibo.com/offers/axis-bank-emi/,Flipkart Axis Bank Superelite Credit Card
https://gos3.ibcdn.com/img-1751609371.jpg,"Hotels, Flights",Up to 15% OFF on Travel Bookings!,Limited period offer,https://www.goibibo.com/offers/axis-bank-emi/,Axis Bank Miles
https://gos3.ibcdn.com/img-1751609371.jpg,"Hotels, Flights",Up to 15% OFF on Travel Bookings!,Limited period offer,https://www.goibibo.com/offers/axis-bank-emi/,More World Select Credit Card
https://gos3.ibcdn.com/img-1751609371.jpg,"Hotels, Flights",Up to 15% OFF on Travel Bookings!,Limited period offer,https://www.goibibo.com/offers/axis-bank-emi/,Axis Bank Magnus Credit Card
https://gos3.ibcdn.com/img-1751609371.jpg,"Hotels, Flights",Up to 15% OFF on Travel Bookings!,Limited period offer,https://www.goibibo.com/offers/axis-bank-emi/,Samsung Axis Bank Infinite Credit Card
https://gos3.ibcdn.com/img-1751609371.jpg,"Hotels, Flights",Up to 15% OFF on Travel Bookings!,Limited period offer,https://www.goibibo.com/offers/axis-bank-emi/,Axis Bank Miles
https://gos3.ibcdn.com/img-1751609371.jpg,"Hotels, Flights",Up to 15% OFF on Travel Bookings!,Limited period offer,https://www.goibibo.com/offers/axis-bank-emi/,More World Credit Card
https://gos3.ibcdn.com/img-1751609371.jpg,"Hotels, Flights",Up to 15% OFF on Travel Bookings!,Limited period offer,https://www.goibibo.com/offers/axis-bank-emi/,Axis Bank Neo Credit Card
https://gos3.ibcdn.com/img-1751609371.jpg,"Hotels, Flights",Up to 15% OFF on Travel Bookings!,Limited period offer,https://www.goibibo.com/offers/axis-bank-emi/,Axis Bank Privilege Easy Credit Card
https://gos3.ibcdn.com/img-1751609371.jpg,"Hotels, Flights",Up to 15% OFF on Travel Bookings!,Limited period offer,https://www.goibibo.com/offers/axis-bank-emi/,Axis Bank Vistara Infinite Credit Card
,,,,,
https://gos3.ibcdn.com/offer-ih-1727984177.jpg,"Hotels, Flights",Get Up to 15% OFF* on Flights and Hotels!,Limited period offer,https://www.goibibo.com/offers/hsbc-cc/,HSBC TravelOne Credit Card
https://gos3.ibcdn.com/offer-ih-1727984177.jpg,"Hotels, Flights",Get Up to 15% OFF* on Flights and Hotels!,Limited period offer,https://www.goibibo.com/offers/hsbc-cc/,HSBC Visa Platinum Credit Card
https://gos3.ibcdn.com/offer-ih-1727984177.jpg,"Hotels, Flights",Get Up to 15% OFF* on Flights and Hotels!,Limited period offer,https://www.goibibo.com/offers/hsbc-cc/,HSBC Taj Credit Card
https://gos3.ibcdn.com/offer-ih-1727984177.jpg,"Hotels, Flights",Get Up to 15% OFF* on Flights and Hotels!,Limited period offer,https://www.goibibo.com/offers/hsbc-cc/,HSBC Live+ Credit Card
https://gos3.ibcdn.com/offer-ih-1727984177.jpg,"Hotels, Flights",Get Up to 15% OFF* on Flights and Hotels!,Limited period offer,https://www.goibibo.com/offers/hsbc-cc/,HSBC Premier Mastercard Credit Card
https://gos3.ibcdn.com/hsbc-bank-1741849094.jpg,"Hotels, Flights",Get Up to 15% OFF on Travel Bookings!,Limited period offer,https://www.goibibo.com/offers/hsbc-emi/,HSBC TravelOne Credit Card
https://gos3.ibcdn.com/hsbc-bank-1741849094.jpg,"Hotels, Flights",Get Up to 15% OFF on Travel Bookings!,Limited period offer,https://www.goibibo.com/offers/hsbc-emi/,HSBC Visa Platinum Credit Card
https://gos3.ibcdn.com/hsbc-bank-1741849094.jpg,"Hotels, Flights",Get Up to 15% OFF on Travel Bookings!,Limited period offer,https://www.goibibo.com/offers/hsbc-emi/,HSBC Taj Credit Card
https://gos3.ibcdn.com/hsbc-bank-1741849094.jpg,"Hotels, Flights",Get Up to 15% OFF on Travel Bookings!,Limited period offer,https://www.goibibo.com/offers/hsbc-emi/,HSBC Live+ Credit Card
https://gos3.ibcdn.com/hsbc-bank-1741849094.jpg,"Hotels, Flights",Get Up to 15% OFF on Travel Bookings!,Limited period offer,https://www.goibibo.com/offers/hsbc-emi/,HSBC Premier Mastercard Credit Card
https://gos3.ibcdn.com/offer-1727293331.jpg,"Hotels, Flights",Get up to12% Instant Discount*,Limited period offer,https://www.goibibo.com/offers/idfc-ncemi/,IDFC Bank First Millennia Credit Card
https://gos3.ibcdn.com/offer-1727293331.jpg,"Hotels, Flights",Get up to12% Instant Discount*,Limited period offer,https://www.goibibo.com/offers/idfc-ncemi/,IDFC First Power RuPay Credit Card
https://gos3.ibcdn.com/offer-1727293331.jpg,"Hotels, Flights",Get up to12% Instant Discount*,Limited period offer,https://www.goibibo.com/offers/idfc-ncemi/,IDFC First Select Credit Card
https://gos3.ibcdn.com/offer-1727293331.jpg,"Hotels, Flights",Get up to12% Instant Discount*,Limited period offer,https://www.goibibo.com/offers/idfc-ncemi/,IDFC First Classic Credit Card
https://gos3.ibcdn.com/offer-1727293331.jpg,"Hotels, Flights",Get up to12% Instant Discount*,Limited period offer,https://www.goibibo.com/offers/idfc-ncemi/,IDFC First Earn RuPay Credit Card
https://gos3.ibcdn.com/offer-1727293331.jpg,"Hotels, Flights",Get up to12% Instant Discount*,Limited period offer,https://www.goibibo.com/offers/idfc-ncemi/,IDFC First Power+ RuPay Credit Card
https://gos3.ibcdn.com/offer-1727293331.jpg,"Hotels, Flights",Get up to12% Instant Discount*,Limited period offer,https://www.goibibo.com/offers/idfc-ncemi/,IDFC First SWYP Credit Card
https://gos3.ibcdn.com/offer-1727293331.jpg,"Hotels, Flights",Get up to12% Instant Discount*,Limited period offer,https://www.goibibo.com/offers/idfc-ncemi/,IDFC First Wealth Credit Card
https://gos3.ibcdn.com/offer-1727293331.jpg,"Hotels, Flights",Get up to12% Instant Discount*,Limited period offer,https://www.goibibo.com/offers/idfc-ncemi/,IDFC Mayura Credit Card
https://gos3.ibcdn.com/offer-1727293331.jpg,"Hotels, Flights",Get up to12% Instant Discount*,Limited period offer,https://www.goibibo.com/offers/idfc-ncemi/,IDFC First Private Credit Card
https://gos3.ibcdn.com/offer-1727293331.jpg,"Hotels, Flights",Get up to12% Instant Discount*,Limited period offer,https://www.goibibo.com/offers/idfc-ncemi/,IDFC First Ashva Credit Card
https://gos3.ibcdn.com/offer-1727293331.jpg,"Hotels, Flights",Get up to12% Instant Discount*,Limited period offer,https://www.goibibo.com/offers/idfc-ncemi/,IDFC First Wow Credit Card
,,,,,
,,,,,
https://gos3.ibcdn.com/top1-1711545023.jpg,"Hotels, Flights",Get Up To 15% Instant Discount!,*Limited Period Offers,https://www.goibibo.com/offers/yes-bank-emi/,Yes ELITE + Credit Card
https://gos3.ibcdn.com/top1-1711545023.jpg,"Hotels, Flights",Get Up To 15% Instant Discount!,*Limited Period Offers,https://www.goibibo.com/offers/yes-bank-emi/,Yes Prosperity Reward Plus Credit Card
https://gos3.ibcdn.com/top1-1711545023.jpg,"Hotels, Flights",Get Up To 15% Instant Discount!,*Limited Period Offers,https://www.goibibo.com/offers/yes-bank-emi/,Yes Bank Card Anq Phi Credit  Card
https://gos3.ibcdn.com/top1-1711545023.jpg,"Hotels, Flights",Get Up To 15% Instant Discount!,*Limited Period Offers,https://www.goibibo.com/offers/yes-bank-emi/,YES Bank Paisabazaar Paisasave Credit Card
https://gos3.ibcdn.com/top1-1711545023.jpg,"Hotels, Flights",Get Up To 15% Instant Discount!,*Limited Period Offers,https://www.goibibo.com/offers/yes-bank-emi/,YES Bank Marquee Credit Card
https://gos3.ibcdn.com/top1-1711545023.jpg,"Hotels, Flights",Get Up To 15% Instant Discount!,*Limited Period Offers,https://www.goibibo.com/offers/yes-bank-emi/,Yes Prosperity Cashback Plus Credit Card
https://gos3.ibcdn.com/top1-1711545023.jpg,"Hotels, Flights",Get Up To 15% Instant Discount!,*Limited Period Offers,https://www.goibibo.com/offers/yes-bank-emi/,Yes EMI Credit Card
https://gos3.ibcdn.com/top1-1711545023.jpg,"Hotels, Flights",Get Up To 15% Instant Discount!,*Limited Period Offers,https://www.goibibo.com/offers/yes-bank-emi/,Yes Reserv Credit Card
https://gos3.ibcdn.com/top1-1711545023.jpg,"Hotels, Flights",Get Up To 15% Instant Discount!,*Limited Period Offers,https://www.goibibo.com/offers/yes-bank-emi/,Yes Prosperity Cashback Credit Card
https://gos3.ibcdn.com/top1-1711545023.jpg,"Hotels, Flights",Get Up To 15% Instant Discount!,*Limited Period Offers,https://www.goibibo.com/offers/yes-bank-emi/,Yes Bank BYOC Credit Card
https://gos3.ibcdn.com/top1-1711545023.jpg,"Hotels, Flights",Get Up To 15% Instant Discount!,*Limited Period Offers,https://www.goibibo.com/offers/yes-bank-emi/,Yes Bank Finbooster Credit Card
https://gos3.ibcdn.com/top1-1711545023.jpg,"Hotels, Flights",Get Up To 15% Instant Discount!,*Limited Period Offers,https://www.goibibo.com/offers/yes-bank-emi/,Yes Bank Wellness Credit Card
https://gos3.ibcdn.com/top1-1711545023.jpg,"Hotels, Flights",Get Up To 15% Instant Discount!,*Limited Period Offers,https://www.goibibo.com/offers/yes-bank-emi/,Yes Private Prime Credit Card
https://gos3.ibcdn.com/top1-1711545023.jpg,"Hotels, Flights",Get Up To 15% Instant Discount!,*Limited Period Offers,https://www.goibibo.com/offers/yes-bank-emi/,Yes Bank Wellness Plus Credit Card
https://gos3.ibcdn.com/top1-1711545023.jpg,"Hotels, Flights",Get Up To 15% Instant Discount!,*Limited Period Offers,https://www.goibibo.com/offers/yes-bank-emi/,Yes Prosperity Reward Credit Card
https://gos3.ibcdn.com/top1-1711545023.jpg,"Hotels, Flights",Get Up To 15% Instant Discount!,*Limited Period Offers,https://www.goibibo.com/offers/yes-bank-emi/,Yes Bank Anq Pi Credit Card
https://gos3.ibcdn.com/top1-1711545023.jpg,"Hotels, Flights",Get Up To 15% Instant Discount!,*Limited Period Offers,https://www.goibibo.com/offers/yes-bank-emi/,YES Bank Rio RuPay Credit Card
https://gos3.ibcdn.com/top1-1711545023.jpg,"Hotels, Flights",Get Up To 15% Instant Discount!,*Limited Period Offers,https://www.goibibo.com/offers/yes-bank-emi/,Yes Prosperity Edge Credit Card
https://gos3.ibcdn.com/offers-1736023007.jpg,"Hotels, Flights",Get up to15% Instant Discount*,Valid till 30th Sep'25,https://www.goibibo.com/offers/federal/,Fed Starbiz Rupay Credit Card
https://gos3.ibcdn.com/offers-1736023007.jpg,"Hotels, Flights",Get up to15% Instant Discount*,Valid till 30th Sep'25,https://www.goibibo.com/offers/federal/,Federal Bank Mastercard Signet
https://gos3.ibcdn.com/offers-1736023007.jpg,"Hotels, Flights",Get up to15% Instant Discount*,Valid till 30th Sep'25,https://www.goibibo.com/offers/federal/,Federal Bank MagniFi Credit Card
https://gos3.ibcdn.com/offers-1736023007.jpg,"Hotels, Flights",Get up to15% Instant Discount*,Valid till 30th Sep'25,https://www.goibibo.com/offers/federal/,Federal Bank AmpliFi Credit Card
https://gos3.ibcdn.com/offers-1736023007.jpg,"Hotels, Flights",Get up to15% Instant Discount*,Valid till 30th Sep'25,https://www.goibibo.com/offers/federal/,Federal Bank Wave Credit Card
https://gos3.ibcdn.com/offers-1736023007.jpg,"Hotels, Flights",Get up to15% Instant Discount*,Valid till 30th Sep'25,https://www.goibibo.com/offers/federal/,Federal Bank Rupay Signet Credit Card
https://gos3.ibcdn.com/offers-1736023007.jpg,"Hotels, Flights",Get up to15% Instant Discount*,Valid till 30th Sep'25,https://www.goibibo.com/offers/federal/,Federal Bank Scapia Credit Card
https://gos3.ibcdn.com/offers-1736023007.jpg,"Hotels, Flights",Get up to15% Instant Discount*,Valid till 30th Sep'25,https://www.goibibo.com/offers/federal/,Federal Bank Visa Celesta
https://gos3.ibcdn.com/offers-1736023007.jpg,"Hotels, Flights",Get up to15% Instant Discount*,Valid till 30th Sep'25,https://www.goibibo.com/offers/federal/,Federal Bank Visa Imperio
